{
  "analysis_id": "50e71c0c-6dac-4361-8e29-c78b7afcf5cd",
  "created_at": "2026-08-02T20:34:28.933774+00:00",
  "data_source": {
    "collection": "sentinel-2-l2a",
    "license": "Copernicus Sentinel data terms",
    "provider": "Microsoft Planetary Computer",
    "stac_endpoint": "https://planetarycomputer.microsoft.com/api/stac/v1"
  },
  "outputs": [
    {
      "artifact_type": "ndvi_cog",
      "content_type": "image/tiff",
      "path": "analyses/50e71c0c-6dac-4361-8e29-c78b7afcf5cd/scenes/S2A_MSIL2A_20240408T161831_R040_T16TGN_20240410T211148/ndvi.tif",
      "scene_item_id": "S2A_MSIL2A_20240408T161831_R040_T16TGN_20240410T211148",
      "sha256": "cd93d8547b9d8c489b679be281132a256e460d91dce210b8ef219ef984b7bea4",
      "size_bytes": 3088334
    },
    {
      "artifact_type": "ndvi_preview",
      "content_type": "image/png",
      "path": "analyses/50e71c0c-6dac-4361-8e29-c78b7afcf5cd/scenes/S2A_MSIL2A_20240408T161831_R040_T16TGN_20240410T211148/ndvi_preview.png",
      "scene_item_id": "S2A_MSIL2A_20240408T161831_R040_T16TGN_20240410T211148",
      "sha256": "438d1d15d39d9889a71f00e05a456acc12ecc70ff2cc17c5867cdc323fbe7691",
      "size_bytes": 501911
    },
    {
      "artifact_type": "scene_summary",
      "content_type": "application/json",
      "path": "analyses/50e71c0c-6dac-4361-8e29-c78b7afcf5cd/scenes/S2A_MSIL2A_20240408T161831_R040_T16TGN_20240410T211148/summary.json",
      "scene_item_id": "S2A_MSIL2A_20240408T161831_R040_T16TGN_20240410T211148",
      "sha256": "5b6093411864ef556ed040fb804603b122bf2d3cff89ea46d6d7665343a21441",
      "size_bytes": 2291
    },
    {
      "artifact_type": "true_color_preview",
      "content_type": "image/png",
      "path": "analyses/50e71c0c-6dac-4361-8e29-c78b7afcf5cd/scenes/S2A_MSIL2A_20240408T161831_R040_T16TGN_20240410T211148/true_color.png",
      "scene_item_id": "S2A_MSIL2A_20240408T161831_R040_T16TGN_20240410T211148",
      "sha256": "83b78d1eb46e9a1d1ef38ac73d21b6bf9bf2fc99c2907b27a52650520eea3ae7",
      "size_bytes": 543961
    },
    {
      "artifact_type": "ndvi_cog",
      "content_type": "image/tiff",
      "path": "analyses/50e71c0c-6dac-4361-8e29-c78b7afcf5cd/scenes/S2A_MSIL2A_20240531T162841_R083_T17TLH_20240601T010652/ndvi.tif",
      "scene_item_id": "S2A_MSIL2A_20240531T162841_R083_T17TLH_20240601T010652",
      "sha256": "bd4498de8ad8f4545e82400efbb222f025ffc9252880ffe8b3143da17420ba82",
      "size_bytes": 6329276
    },
    {
      "artifact_type": "ndvi_preview",
      "content_type": "image/png",
      "path": "analyses/50e71c0c-6dac-4361-8e29-c78b7afcf5cd/scenes/S2A_MSIL2A_20240531T162841_R083_T17TLH_20240601T010652/ndvi_preview.png",
      "scene_item_id": "S2A_MSIL2A_20240531T162841_R083_T17TLH_20240601T010652",
      "sha256": "e911de6ab9406ddc67e51eafa0d0b5b83a5619773c42ab07575cef0c30c182b6",
      "size_bytes": 1004188
    },
    {
      "artifact_type": "scene_summary",
      "content_type": "application/json",
      "path": "analyses/50e71c0c-6dac-4361-8e29-c78b7afcf5cd/scenes/S2A_MSIL2A_20240531T162841_R083_T17TLH_20240601T010652/summary.json",
      "scene_item_id": "S2A_MSIL2A_20240531T162841_R083_T17TLH_20240601T010652",
      "sha256": "34987b621f605d22992aea56ffda4f30a535d9f520fb4b149141cd80cd77d903",
      "size_bytes": 2309
    },
    {
      "artifact_type": "true_color_preview",
      "content_type": "image/png",
      "path": "analyses/50e71c0c-6dac-4361-8e29-c78b7afcf5cd/scenes/S2A_MSIL2A_20240531T162841_R083_T17TLH_20240601T010652/true_color.png",
      "scene_item_id": "S2A_MSIL2A_20240531T162841_R083_T17TLH_20240601T010652",
      "sha256": "90c883dfbb20675f1c142d3086734f4b0ed1e7cc0841e88471cee0e120c3e4ec",
      "size_bytes": 1049271
    },
    {
      "artifact_type": "ndvi_cog",
      "content_type": "image/tiff",
      "path": "analyses/50e71c0c-6dac-4361-8e29-c78b7afcf5cd/scenes/S2B_MSIL2A_20240612T161829_R040_T17TLH_20240612T221210/ndvi.tif",
      "scene_item_id": "S2B_MSIL2A_20240612T161829_R040_T17TLH_20240612T221210",
      "sha256": "467f923507e0d4505f4f5212a1c42a90e91c7902b12da36ed0109321e91d4802",
      "size_bytes": 6348729
    },
    {
      "artifact_type": "ndvi_preview",
      "content_type": "image/png",
      "path": "analyses/50e71c0c-6dac-4361-8e29-c78b7afcf5cd/scenes/S2B_MSIL2A_20240612T161829_R040_T17TLH_20240612T221210/ndvi_preview.png",
      "scene_item_id": "S2B_MSIL2A_20240612T161829_R040_T17TLH_20240612T221210",
      "sha256": "7ce20bca2db57956d060eb20cdee9b26f87c15eadca886a30ea1e21eea6a541d",
      "size_bytes": 1012887
    },
    {
      "artifact_type": "scene_summary",
      "content_type": "application/json",
      "path": "analyses/50e71c0c-6dac-4361-8e29-c78b7afcf5cd/scenes/S2B_MSIL2A_20240612T161829_R040_T17TLH_20240612T221210/summary.json",
      "scene_item_id": "S2B_MSIL2A_20240612T161829_R040_T17TLH_20240612T221210",
      "sha256": "46c7043ab17ab31472f3bf89fde08afe0c5b510de387371e2c2bb0de9238cbce",
      "size_bytes": 2307
    },
    {
      "artifact_type": "true_color_preview",
      "content_type": "image/png",
      "path": "analyses/50e71c0c-6dac-4361-8e29-c78b7afcf5cd/scenes/S2B_MSIL2A_20240612T161829_R040_T17TLH_20240612T221210/true_color.png",
      "scene_item_id": "S2B_MSIL2A_20240612T161829_R040_T17TLH_20240612T221210",
      "sha256": "24484525d28ec9e5476f4c04067045d77a859e17a4d35ab0f153046e3ce3f1ab",
      "size_bytes": 1059548
    },
    {
      "artifact_type": "ndvi_cog",
      "content_type": "image/tiff",
      "path": "analyses/50e71c0c-6dac-4361-8e29-c78b7afcf5cd/scenes/S2A_MSIL2A_20240727T161831_R040_T16TGN_20240727T233652/ndvi.tif",
      "scene_item_id": "S2A_MSIL2A_20240727T161831_R040_T16TGN_20240727T233652",
      "sha256": "da884c7f420a2d52be9d41db84f10f6fa8f6de71d498e9550db3e502dcc07bef",
      "size_bytes": 3059367
    },
    {
      "artifact_type": "ndvi_preview",
      "content_type": "image/png",
      "path": "analyses/50e71c0c-6dac-4361-8e29-c78b7afcf5cd/scenes/S2A_MSIL2A_20240727T161831_R040_T16TGN_20240727T233652/ndvi_preview.png",
      "scene_item_id": "S2A_MSIL2A_20240727T161831_R040_T16TGN_20240727T233652",
      "sha256": "d956cbb3b4eb2693544e60043451b6fbf6a2b7eb6bae602417103c26b37d7d30",
      "size_bytes": 514020
    },
    {
      "artifact_type": "scene_summary",
      "content_type": "application/json",
      "path": "analyses/50e71c0c-6dac-4361-8e29-c78b7afcf5cd/scenes/S2A_MSIL2A_20240727T161831_R040_T16TGN_20240727T233652/summary.json",
      "scene_item_id": "S2A_MSIL2A_20240727T161831_R040_T16TGN_20240727T233652",
      "sha256": "7f37b1b783e314e4bc047ce9a24f59f4198b3ec61e7eb1d9d00a86ef7cbee9b4",
      "size_bytes": 2319
    },
    {
      "artifact_type": "true_color_preview",
      "content_type": "image/png",
      "path": "analyses/50e71c0c-6dac-4361-8e29-c78b7afcf5cd/scenes/S2A_MSIL2A_20240727T161831_R040_T16TGN_20240727T233652/true_color.png",
      "scene_item_id": "S2A_MSIL2A_20240727T161831_R040_T16TGN_20240727T233652",
      "sha256": "d7f6ac83ae7693ec57f0afce8a000fc9c889b1bd914603567ff14292a9e9c16d",
      "size_bytes": 539869
    },
    {
      "artifact_type": "ndvi_cog",
      "content_type": "image/tiff",
      "path": "analyses/50e71c0c-6dac-4361-8e29-c78b7afcf5cd/scenes/S2B_MSIL2A_20240831T161829_R040_T16TGN_20240831T202059/ndvi.tif",
      "scene_item_id": "S2B_MSIL2A_20240831T161829_R040_T16TGN_20240831T202059",
      "sha256": "2d359c58ea6ea884731a5516e4f07871188edf01daf3c01c40618e317b465975",
      "size_bytes": 3054659
    },
    {
      "artifact_type": "ndvi_preview",
      "content_type": "image/png",
      "path": "analyses/50e71c0c-6dac-4361-8e29-c78b7afcf5cd/scenes/S2B_MSIL2A_20240831T161829_R040_T16TGN_20240831T202059/ndvi_preview.png",
      "scene_item_id": "S2B_MSIL2A_20240831T161829_R040_T16TGN_20240831T202059",
      "sha256": "1151156c1347a19f5f6f4d23ff6ebb9256fb4242f567c12696d260895385c11e",
      "size_bytes": 506705
    },
    {
      "artifact_type": "scene_summary",
      "content_type": "application/json",
      "path": "analyses/50e71c0c-6dac-4361-8e29-c78b7afcf5cd/scenes/S2B_MSIL2A_20240831T161829_R040_T16TGN_20240831T202059/summary.json",
      "scene_item_id": "S2B_MSIL2A_20240831T161829_R040_T16TGN_20240831T202059",
      "sha256": "a6dee34708296fd11d6bc1884784481a302aa3fe0d45f33dc3db561a5956d799",
      "size_bytes": 2303
    },
    {
      "artifact_type": "true_color_preview",
      "content_type": "image/png",
      "path": "analyses/50e71c0c-6dac-4361-8e29-c78b7afcf5cd/scenes/S2B_MSIL2A_20240831T161829_R040_T16TGN_20240831T202059/true_color.png",
      "scene_item_id": "S2B_MSIL2A_20240831T161829_R040_T16TGN_20240831T202059",
      "sha256": "8c3bb20c97c7cc5a513467a05dba5d098d3ddcd11dfdf1f944f0826df07ba659",
      "size_bytes": 542228
    },
    {
      "artifact_type": "ndvi_cog",
      "content_type": "image/tiff",
      "path": "analyses/50e71c0c-6dac-4361-8e29-c78b7afcf5cd/scenes/S2A_MSIL2A_20241005T162141_R040_T16TGN_20241005T220355/ndvi.tif",
      "scene_item_id": "S2A_MSIL2A_20241005T162141_R040_T16TGN_20241005T220355",
      "sha256": "9d33a782b4f605825efef96e41f6fa12389942a2db1684eb2df56d650080b87b",
      "size_bytes": 3058098
    },
    {
      "artifact_type": "ndvi_preview",
      "content_type": "image/png",
      "path": "analyses/50e71c0c-6dac-4361-8e29-c78b7afcf5cd/scenes/S2A_MSIL2A_20241005T162141_R040_T16TGN_20241005T220355/ndvi_preview.png",
      "scene_item_id": "S2A_MSIL2A_20241005T162141_R040_T16TGN_20241005T220355",
      "sha256": "bf749aa45accd3ded8344d50f8e6ce8c844c8407def32b86c627716f569d7f8d",
      "size_bytes": 514640
    },
    {
      "artifact_type": "scene_summary",
      "content_type": "application/json",
      "path": "analyses/50e71c0c-6dac-4361-8e29-c78b7afcf5cd/scenes/S2A_MSIL2A_20241005T162141_R040_T16TGN_20241005T220355/summary.json",
      "scene_item_id": "S2A_MSIL2A_20241005T162141_R040_T16TGN_20241005T220355",
      "sha256": "61e6f6cb051d8f3316fcd1e35cac76782fb7162c1e90539e52074d7552432c07",